{
    "title": "Advantages of fossil fuels (checkbox)",
    "topic": "Energy",
    "tags": ["Comparative"],
    "clientFiles": ["client.js", "power-station.jpg"],
    "type": "Checkbox",
    "options": {
        "text": "Which of the following are advantages of fossil fuels relative to renewable energy sources? Select all that apply.<img src=\"<% print(questionFile(\"power-station.jpg\")) %>\" width=\"400px\" class=\"img-responsive center-block\" />",
        "correctAnswers": [
            "Cheap",
            "High energy density",
            "Provide energy on demand"            
        ],
        "incorrectAnswers": [
            "Non-polluting",
            "Low energy density",
            "Low production of carbon dioxide",
            "High production of carbon dioxide",
            "Secure",
            "Sustainable",
            "Low energy return"
        ],
        "numberAnswers": 5,
        "minCorrectAnswers": 1,
        "maxCorrectAnswers": 3
    }
}
